{
  "schema": "return18-resource-v1",
  "name": "r121_full_original_parallel_lane2_v1",
  "main_approved": true,
  "approved_by": "main thread: finish all remaining original84 qualified native deployments in frozen full18/89 structural dataset. Exactly2 independent different-key processes per assignedGPU; unchanged batch1, per-task seeds/weights/POMO/decode/profile and1280 endpoints each. Knownfailed5 routed to declared input-boundary recovery, never removed fromlegalpool. OriginalGPUmutex waits any existing repair/report; no automaticretry.",
  "approved_utc": "2026-10-29T20:52:35+00:00",
  "protocol": {
    "path": "code/V4/runs/R121_structural_families/preparation/collection_persistent_v1/protocol.json",
    "sha256": "c0c1ad3aed88e3a03cd3dd435675d98121ee85e5a08daa8581f9a0c4f8d5975d"
  },
  "source_sha256": {
    "code/V4/return18_launch.py": "c2971efab4e863eaf2cceab98d318b7ccee131e7b920a416b132e2dae1d3a5d8",
    "code/V4/run_v4_return18.sh": "f96ffae480bb3d45708d6e843f8c87ab34cfb1446095b2bef9cdba5a8fba28bf",
    "code/V4/r120_launch.py": "d1ce6b3f179529553de38cb37f5183587ab7c068e9310a996fb6e537bbd3a85a",
    "code/V4/r81_queue.py": "cd614a609198d127ad9a632e08044cdcb7fff27ba8e84d519856973f4c076f67",
    "code/V4/r121_collection.py": "876cff5800f0c0a1067b7a36eee3e154b4b73dedb8030873a69dd7cefec49674",
    "code/V4/r121_structural_data.py": "719511ae34a02b0a1db417c70761d9289cc380a6a654b473f12b69bcc32d1771",
    "code/V4/r121_parallel_collection.py": "a9e686d13f0acb4e956178a4d21bf91c3851307a05cc1839ed411333c4bad218",
    "code/V4/runs/R121_structural_families/preparation/collection_persistent_v1/main_r120_release.json": "827f6bef74766657bd552fd6e668815533b88ca5ff83d0043ff29d7e3e5b4a11",
    "code/V4/runs/R121_structural_families/preparation/collection_persistent_v1/main_binding_lane2.json": "d934b8342c1ed9ec480624dc6c784f7c3b9f81f4f780d29f9356223170325695"
  },
  "jobs": [
    {
      "id": "R121_full_original_parallel_lane2",
      "arm": "R121",
      "slot": "gpu03_1",
      "root": "code/V4/runs/R121_structural_families/preparation/collection_persistent_v1",
      "stages": [
        {
          "id": "original_qualified_full_shards",
          "kind": "collect",
          "argv": [
            "python",
            "-B",
            "-u",
            "-m",
            "code.V4.r121_parallel_collection",
            "--root",
            "/public/home/shiys/0selection2/code/V4/runs/R121_structural_families/preparation/collection_persistent_v1",
            "--lane",
            "2",
            "--concurrency",
            "2",
            "--max-jobs-per-deployment",
            "1280",
            "--device",
            "cuda:0",
            "--release",
            "/public/home/shiys/0selection2/code/V4/runs/R121_structural_families/preparation/collection_persistent_v1/main_r120_release.json",
            "--binding",
            "/public/home/shiys/0selection2/code/V4/runs/R121_structural_families/preparation/collection_persistent_v1/main_binding_lane2.json"
          ]
        }
      ]
    }
  ]
}
